{"$schema":"https://json-schema.org/draft/2020-12/schema","type":"object","required":["schemaVersion","id","frameworkId","type","title","summary","scope","relatedPackages","relatedSymbols","relatedComponents","prerequisites","claims","recipes","constraints","limitations","evidence","sourceBundleId","generator","reviewStatus","publicationStatus","createdAt","updatedAt"],"properties":{"schemaVersion":{"type":"string"},"id":{"type":"string","pattern":"^[a-z0-9][a-z0-9-]*$"},"frameworkId":{"type":"string"},"type":{"enum":["framework_concept","package_overview","component_api","usage_recipe","lifecycle","event_pattern","development_convention","build_workflow","troubleshooting","version_note","limitation"]},"title":{"type":"string","maxLength":300},"summary":{"type":"string","maxLength":3000},"scope":{"type":"object","required":["sourceCommit","catalogRootHash","symbolRootHash"],"properties":{"sourceCommit":{"type":"string","pattern":"^[a-f0-9]{40}$"},"catalogRootHash":{"type":"string","pattern":"^sha256:"},"symbolRootHash":{"type":"string","pattern":"^sha256:"}}},"relatedPackages":{"type":"array","items":{"type":"string"}},"relatedSymbols":{"type":"array","items":{"type":"string"}},"relatedComponents":{"type":"array","items":{"type":"string"}},"prerequisites":{"type":"array","items":{"type":"string"}},"claims":{"type":"array","items":{"type":"object","required":["id","text","status","confidence","evidenceIds","appliesTo","exceptions","limitations","tags"],"properties":{"id":{"type":"string"},"text":{"type":"string","maxLength":1200},"status":{"enum":["observed","verified","manual","inferred"]},"confidence":{"enum":["high","medium","low"]},"evidenceIds":{"type":"array","minItems":1,"items":{"type":"string"}},"appliesTo":{"type":"array","items":{"type":"string"}},"exceptions":{"type":"array","items":{"type":"string"}},"limitations":{"type":"array","items":{"type":"string"}},"tags":{"type":"array","items":{"type":"string"}}}}},"recipes":{"type":"array","items":{"type":"object"}},"constraints":{"type":"array","items":{"type":"string"}},"limitations":{"type":"array","items":{"type":"string"}},"evidence":{"type":"array","items":{"type":"object"}},"sourceBundleId":{"type":"string"},"generator":{"type":"string"},"reviewStatus":{"enum":["pending","reviewed"]},"publicationStatus":{"enum":["draft","published","superseded"]},"createdAt":{"type":"string"},"updatedAt":{"type":"string"}}}
