{
  "schemaVersion": "1.0.0",
  "id": "ncom-public-import-type-location-workflow",
  "frameworkId": "ncom",
  "type": "development_convention",
  "title": "Public import and type location workflow",
  "summary": "从 package exports 和类型声明定位公共导入与 Props 类型的证据。",
  "scope": {
    "sourceCommit": "a350b576bbeae6c6254273037a17d2a8730fb80f",
    "catalogRootHash": "sha256:0dbfa378eedaaef0b31867b679e7932157eb63bb0cc4e3fa0fb0a0d1869c6518",
    "symbolRootHash": "sha256:52e4461d185ce375263aca5e412b2d93f402d906867bf0940bffc9807eec6297"
  },
  "relatedPackages": [
    "package-ncom-components"
  ],
  "relatedSymbols": [],
  "relatedComponents": [],
  "prerequisites": [],
  "claims": [
    {
      "id": "ncom-public-import-type-location-workflow-claim-1",
      "text": "@ncom/components 的 package exports 为根入口登记 dist/index.js，并为 types 登记 dist/types/index.d.ts。",
      "status": "observed",
      "confidence": "high",
      "evidenceIds": [
        "E1",
        "E2",
        "E3",
        "E4"
      ],
      "appliesTo": [
        "a350b576bbeae6c6254273037a17d2a8730fb80f"
      ],
      "exceptions": [],
      "limitations": [
        "仅适用于锁定 commit 与所列 Evidence；不推断未提供的运行时行为。"
      ],
      "tags": [
        "workflow",
        "public-api",
        "types"
      ]
    }
  ],
  "recipes": [
    {
      "id": "ncom-public-import-type-location-workflow-recipe-1",
      "steps": [
        "先检查目标 package 的 exports/types。",
        "再用 Symbol Snapshot 确认目标类型的公共可达性。"
      ],
      "evidenceIds": [
        "E1",
        "E2",
        "E3",
        "E4"
      ],
      "limitations": [
        "步骤是证据约束的最小流程，不替代目标项目的验收标准。"
      ]
    }
  ],
  "constraints": [],
  "limitations": [
    "仅适用于锁定 commit 与所列 Evidence；不推断未提供的运行时行为。"
  ],
  "evidence": [
    {
      "id": "E1"
    },
    {
      "id": "E2"
    },
    {
      "id": "E3"
    },
    {
      "id": "E4"
    }
  ],
  "sourceBundleId": "bundle-public-import-types-a350b57-34fd1e38",
  "generator": "manual-evidence-normalization-v0.2.3",
  "reviewStatus": "reviewed",
  "publicationStatus": "published",
  "createdAt": "2026-07-27T00:00:00.000Z",
  "updatedAt": "2026-07-27T06:34:52.801Z"
}
