{
  "schemaVersion": "1.0.0",
  "id": "ncom-package-public-exports",
  "frameworkId": "ncom",
  "type": "package_overview",
  "title": "NCom package and public export structure",
  "summary": "Bounded package/export evidence for the locked NCom commit.",
  "scope": {
    "sourceCommit": "a350b576bbeae6c6254273037a17d2a8730fb80f",
    "catalogRootHash": "sha256:0dbfa378eedaaef0b31867b679e7932157eb63bb0cc4e3fa0fb0a0d1869c6518",
    "symbolRootHash": "sha256:52e4461d185ce375263aca5e412b2d93f402d906867bf0940bffc9807eec6297"
  },
  "relatedPackages": [
    "package-ncom-all",
    "package-ncom-components",
    "package-ncom-core"
  ],
  "relatedSymbols": [],
  "relatedComponents": [],
  "prerequisites": [],
  "claims": [
    {
      "id": "package-export-observed",
      "text": "The bounded catalog evidence records a package or export reference for the locked commit.",
      "status": "observed",
      "confidence": "medium",
      "evidenceIds": [
        "E1"
      ],
      "appliesTo": [
        "a350b576bbeae6c6254273037a17d2a8730fb80f"
      ],
      "exceptions": [],
      "limitations": [
        "This unit does not enumerate every export."
      ],
      "tags": [
        "package",
        "public-export"
      ]
    }
  ],
  "recipes": [],
  "constraints": [],
  "limitations": [
    "Only bounded evidence is summarized.",
    "Published after evidence validation and explicit review."
  ],
  "evidence": [
    {
      "id": "E1"
    }
  ],
  "sourceBundleId": "bundle-package-public-exports-a350b57-a6c396f7",
  "generator": "manual-evidence-normalization",
  "reviewStatus": "reviewed",
  "publicationStatus": "published",
  "createdAt": "2026-07-23T09:20:00.000Z",
  "updatedAt": "2026-07-23T09:18:12.862Z"
}
