{
  "schemaVersion": "1.0.0",
  "id": "ncom-family-input-controls",
  "frameworkId": "ncom",
  "type": "framework_concept",
  "title": "NCBaseInput component family",
  "summary": "经显式复核、共享 NCBaseInput 基类结构信号的组件家族。",
  "scope": {
    "sourceCommit": "a350b576bbeae6c6254273037a17d2a8730fb80f",
    "catalogRootHash": "sha256:0dbfa378eedaaef0b31867b679e7932157eb63bb0cc4e3fa0fb0a0d1869c6518",
    "symbolRootHash": "sha256:52e4461d185ce375263aca5e412b2d93f402d906867bf0940bffc9807eec6297"
  },
  "relatedPackages": [
    "package-ncom-components"
  ],
  "relatedSymbols": [
    "symbol-f32e437b18b35093",
    "symbol-807eb0ae9ce12155",
    "symbol-b5892e0c99a75e14",
    "symbol-3acb074548a4e758",
    "symbol-a99fecb6fdc985b4",
    "symbol-19f6f638f684784b",
    "symbol-79e59b9a336a902b",
    "symbol-220514ba75c5819d",
    "symbol-f603137634ccebd4",
    "symbol-913f91b67c069d3f",
    "symbol-0bb407c46f1addc1",
    "symbol-ddb8a1b4e3ed42fa",
    "symbol-197e2ca0beecd161",
    "symbol-93d6c96e212b6c45",
    "symbol-1de1e7d99b633bff",
    "symbol-2c138bce1aeff8b0"
  ],
  "relatedComponents": [
    "component-0cf2173ee5c9baab",
    "component-20fc80ccb1f0e2fc",
    "component-247dab7c3d974ab8",
    "component-353a17298f2a74aa",
    "component-44797f1cf18b738c",
    "component-61ecc5922c337020",
    "component-79de77ea33744632",
    "component-a0159c51d9981e02",
    "component-a40ddae472421817",
    "component-a9e97a2a50625851",
    "component-b030cf34d4b5f037",
    "component-b0fbcb97a7f707f4",
    "component-ba3fa1dc30a1d901",
    "component-d2272a6ffe49ae44",
    "component-d3cbe986913febae",
    "component-ebce2e77ab9efccd"
  ],
  "prerequisites": [],
  "claims": [
    {
      "id": "ncom-family-input-controls-claim-1",
      "text": "复核成员在锁定 Symbol Snapshot 中共享 base:NCBaseInput 结构信号。",
      "status": "observed",
      "confidence": "high",
      "evidenceIds": [
        "E1",
        "E2",
        "E3",
        "E4",
        "E5",
        "E6"
      ],
      "appliesTo": [
        "a350b576bbeae6c6254273037a17d2a8730fb80f"
      ],
      "exceptions": [],
      "limitations": [
        "仅适用于锁定 commit 与所列 Evidence；不推断未提供的运行时行为。",
        "候选只表示共享结构信号，不自动证明组件具有相同语义或行为。",
        "发布家族知识前必须显式复核成员范围。",
        "共享 NCBaseInput 基类不表示 props 或事件完全相同。"
      ],
      "tags": [
        "family",
        "input"
      ]
    }
  ],
  "recipes": [],
  "constraints": [],
  "limitations": [
    "仅适用于锁定 commit 与所列 Evidence；不推断未提供的运行时行为。",
    "候选只表示共享结构信号，不自动证明组件具有相同语义或行为。",
    "发布家族知识前必须显式复核成员范围。",
    "共享 NCBaseInput 基类不表示 props 或事件完全相同。"
  ],
  "evidence": [
    {
      "id": "E1"
    },
    {
      "id": "E2"
    },
    {
      "id": "E3"
    },
    {
      "id": "E4"
    },
    {
      "id": "E5"
    },
    {
      "id": "E6"
    }
  ],
  "sourceBundleId": "bundle-family-input-controls-a350b57-d3379378",
  "generator": "manual-evidence-normalization-v0.2.3",
  "reviewStatus": "reviewed",
  "publicationStatus": "published",
  "createdAt": "2026-07-27T00:00:00.000Z",
  "updatedAt": "2026-07-27T06:33:29.266Z"
}
