{
  "schemaVersion": "1.0.0",
  "id": "ncom-lifecycle-callback-structure",
  "frameworkId": "ncom",
  "type": "lifecycle",
  "title": "NCom lifecycle callback structure",
  "summary": "NComponent 的基类与构造阶段结构，范围限定于锁定 commit 的证据片段。",
  "scope": {
    "sourceCommit": "a350b576bbeae6c6254273037a17d2a8730fb80f",
    "catalogRootHash": "sha256:0dbfa378eedaaef0b31867b679e7932157eb63bb0cc4e3fa0fb0a0d1869c6518",
    "symbolRootHash": "sha256:52e4461d185ce375263aca5e412b2d93f402d906867bf0940bffc9807eec6297"
  },
  "relatedPackages": [
    "package-ncom-core"
  ],
  "relatedSymbols": [],
  "relatedComponents": [],
  "prerequisites": [],
  "claims": [
    {
      "id": "ncom-lifecycle-callback-structure-claim-1",
      "text": "NComponent extends HTMLElement；所给构造函数片段创建 EventManager 并以 open 模式 attachShadow。",
      "status": "observed",
      "confidence": "high",
      "evidenceIds": [
        "E1",
        "E2",
        "E3",
        "E4",
        "E5",
        "E6"
      ],
      "appliesTo": [
        "a350b576bbeae6c6254273037a17d2a8730fb80f"
      ],
      "exceptions": [],
      "limitations": [
        "仅适用于锁定 commit 与所列 Evidence；不推断未提供的运行时行为。"
      ],
      "tags": [
        "mechanism",
        "lifecycle"
      ]
    }
  ],
  "recipes": [],
  "constraints": [],
  "limitations": [
    "仅适用于锁定 commit 与所列 Evidence；不推断未提供的运行时行为。"
  ],
  "evidence": [
    {
      "id": "E1"
    },
    {
      "id": "E2"
    },
    {
      "id": "E3"
    },
    {
      "id": "E4"
    },
    {
      "id": "E5"
    },
    {
      "id": "E6"
    }
  ],
  "sourceBundleId": "bundle-lifecycle-callbacks-a350b57-5a3b507c",
  "generator": "manual-evidence-normalization-v0.2.3",
  "reviewStatus": "reviewed",
  "publicationStatus": "published",
  "createdAt": "2026-07-27T00:00:00.000Z",
  "updatedAt": "2026-07-27T06:33:43.924Z"
}
