{
  "schemaVersion": "1.0.0",
  "id": "ncom-ncbutton-api",
  "frameworkId": "ncom",
  "type": "component_api",
  "title": "NCButton API and usage patterns",
  "summary": "Observed NCButton, ButtonProps and ClickEventDetail facts from bounded evidence.",
  "scope": {
    "sourceCommit": "a350b576bbeae6c6254273037a17d2a8730fb80f",
    "catalogRootHash": "sha256:0dbfa378eedaaef0b31867b679e7932157eb63bb0cc4e3fa0fb0a0d1869c6518",
    "symbolRootHash": "sha256:52e4461d185ce375263aca5e412b2d93f402d906867bf0940bffc9807eec6297"
  },
  "relatedPackages": [
    "package-ncom-components",
    "package-ncom-all"
  ],
  "relatedSymbols": [
    "symbol-c7b514bbc7b95fb6",
    "symbol-4ef0a65933001699"
  ],
  "relatedComponents": [
    "component-6279f9bfe1af1227"
  ],
  "prerequisites": [
    "ncom-component-base-model",
    "ncom-event-system"
  ],
  "claims": [
    {
      "id": "button-observed",
      "text": "NCButton, ButtonProps and ClickEventDetail occur in this bounded bundle for the locked commit.",
      "status": "observed",
      "confidence": "high",
      "evidenceIds": [
        "E1",
        "E2",
        "E3"
      ],
      "appliesTo": [
        "a350b576bbeae6c6254273037a17d2a8730fb80f"
      ],
      "exceptions": [],
      "limitations": [
        "The unit does not prove runtime click behavior."
      ],
      "tags": [
        "button",
        "event",
        "public-api"
      ]
    }
  ],
  "recipes": [],
  "constraints": [],
  "limitations": [
    "External Agent draft was schema-rejected; this normalized unit uses the same Evidence ids only.",
    "Published after evidence validation and explicit review."
  ],
  "evidence": [
    {
      "id": "E1"
    },
    {
      "id": "E2"
    },
    {
      "id": "E3"
    }
  ],
  "sourceBundleId": "bundle-ncbutton-api-a350b57-17718594",
  "generator": "manual-evidence-normalization",
  "reviewStatus": "reviewed",
  "publicationStatus": "published",
  "createdAt": "2026-07-23T09:20:00.000Z",
  "updatedAt": "2026-07-23T09:18:27.767Z"
}
