{
  "schemaVersion": "1.0.0",
  "id": "ncom-ncinput-events",
  "frameworkId": "ncom",
  "type": "component_api",
  "title": "NCInput API and value change event",
  "summary": "Observed NCInput-related bounded evidence.",
  "scope": {
    "sourceCommit": "a350b576bbeae6c6254273037a17d2a8730fb80f",
    "catalogRootHash": "sha256:0dbfa378eedaaef0b31867b679e7932157eb63bb0cc4e3fa0fb0a0d1869c6518",
    "symbolRootHash": "sha256:52e4461d185ce375263aca5e412b2d93f402d906867bf0940bffc9807eec6297"
  },
  "relatedPackages": [
    "package-ncom-components",
    "package-ncom-all"
  ],
  "relatedSymbols": [
    "symbol-a99fecb6fdc985b4"
  ],
  "relatedComponents": [],
  "prerequisites": [
    "ncom-component-base-model"
  ],
  "claims": [
    {
      "id": "input-observed",
      "text": "NCInput-related declarations occur in the bounded evidence for the locked commit.",
      "status": "observed",
      "confidence": "medium",
      "evidenceIds": [
        "E1"
      ],
      "appliesTo": [
        "a350b576bbeae6c6254273037a17d2a8730fb80f"
      ],
      "exceptions": [],
      "limitations": [
        "The bundle does not establish every value-change event name."
      ],
      "tags": [
        "input",
        "event"
      ]
    }
  ],
  "recipes": [],
  "constraints": [],
  "limitations": [
    "Static evidence only.",
    "Published after evidence validation and explicit review."
  ],
  "evidence": [
    {
      "id": "E1"
    }
  ],
  "sourceBundleId": "bundle-ncinput-events-a350b57-e96bd3e0",
  "generator": "manual-evidence-normalization",
  "reviewStatus": "reviewed",
  "publicationStatus": "published",
  "createdAt": "2026-07-23T09:20:00.000Z",
  "updatedAt": "2026-07-23T09:18:33.016Z"
}
