{
  "schemaVersion": "1.0.0",
  "id": "ncom-props-declaration-structure",
  "frameworkId": "ncom",
  "type": "framework_concept",
  "title": "NCom props declaration and reflection structure",
  "summary": "组件 Props 接口以可选字段描述组件输入的源码证据。",
  "scope": {
    "sourceCommit": "a350b576bbeae6c6254273037a17d2a8730fb80f",
    "catalogRootHash": "sha256:0dbfa378eedaaef0b31867b679e7932157eb63bb0cc4e3fa0fb0a0d1869c6518",
    "symbolRootHash": "sha256:52e4461d185ce375263aca5e412b2d93f402d906867bf0940bffc9807eec6297"
  },
  "relatedPackages": [
    "package-ncom-components"
  ],
  "relatedSymbols": [],
  "relatedComponents": [],
  "prerequisites": [],
  "claims": [
    {
      "id": "ncom-props-declaration-structure-claim-1",
      "text": "TourProps、WatermarkProps 和 StatisticProps 的所给证据片段均以 TypeScript interface 声明可选属性。",
      "status": "observed",
      "confidence": "high",
      "evidenceIds": [
        "E1",
        "E2",
        "E3",
        "E4"
      ],
      "appliesTo": [
        "a350b576bbeae6c6254273037a17d2a8730fb80f"
      ],
      "exceptions": [],
      "limitations": [
        "仅适用于锁定 commit 与所列 Evidence；不推断未提供的运行时行为。"
      ],
      "tags": [
        "mechanism",
        "props"
      ]
    }
  ],
  "recipes": [],
  "constraints": [],
  "limitations": [
    "仅适用于锁定 commit 与所列 Evidence；不推断未提供的运行时行为。"
  ],
  "evidence": [
    {
      "id": "E1"
    },
    {
      "id": "E2"
    },
    {
      "id": "E3"
    },
    {
      "id": "E4"
    }
  ],
  "sourceBundleId": "bundle-props-reflection-a350b57-34fd1e38",
  "generator": "manual-evidence-normalization-v0.2.3",
  "reviewStatus": "reviewed",
  "publicationStatus": "published",
  "createdAt": "2026-07-27T00:00:00.000Z",
  "updatedAt": "2026-07-27T06:34:45.204Z"
}
