{
  "schemaVersion": "1.0.0",
  "id": "ncom-family-closable-feedback-overlay",
  "frameworkId": "ncom",
  "type": "event_pattern",
  "title": "Closable feedback and overlay family",
  "summary": "经显式复核、共享 close 事件结构信号的 NCAlert、NCDrawer 与 NCModal 家族。",
  "scope": {
    "sourceCommit": "a350b576bbeae6c6254273037a17d2a8730fb80f",
    "catalogRootHash": "sha256:0dbfa378eedaaef0b31867b679e7932157eb63bb0cc4e3fa0fb0a0d1869c6518",
    "symbolRootHash": "sha256:52e4461d185ce375263aca5e412b2d93f402d906867bf0940bffc9807eec6297"
  },
  "relatedPackages": [
    "package-ncom-components"
  ],
  "relatedSymbols": [
    "symbol-92decd1eba35fe57",
    "symbol-ebefa7159f432e34",
    "symbol-28a015f2a94ab4a8"
  ],
  "relatedComponents": [
    "component-078563e274bd74a1",
    "component-59e4204498fb6bcd",
    "component-ea5dc8d798d1d252"
  ],
  "prerequisites": [],
  "claims": [
    {
      "id": "ncom-family-closable-feedback-overlay-claim-1",
      "text": "NCAlert、NCDrawer 与 NCModal 在锁定 Symbol Snapshot 中都登记了 close 事件。",
      "status": "observed",
      "confidence": "high",
      "evidenceIds": [
        "E1",
        "E2",
        "E3"
      ],
      "appliesTo": [
        "a350b576bbeae6c6254273037a17d2a8730fb80f"
      ],
      "exceptions": [],
      "limitations": [
        "仅适用于锁定 commit 与所列 Evidence；不推断未提供的运行时行为。",
        "候选只表示共享结构信号，不自动证明组件具有相同语义或行为。",
        "发布家族知识前必须显式复核成员范围。",
        "该家族仅确认共享 close 事件，不统一视觉或打开方式。"
      ],
      "tags": [
        "family",
        "event",
        "close"
      ]
    }
  ],
  "recipes": [],
  "constraints": [],
  "limitations": [
    "仅适用于锁定 commit 与所列 Evidence；不推断未提供的运行时行为。",
    "候选只表示共享结构信号，不自动证明组件具有相同语义或行为。",
    "发布家族知识前必须显式复核成员范围。",
    "该家族仅确认共享 close 事件，不统一视觉或打开方式。"
  ],
  "evidence": [
    {
      "id": "E1"
    },
    {
      "id": "E2"
    },
    {
      "id": "E3"
    }
  ],
  "sourceBundleId": "bundle-family-closable-a350b57-bdb24fd4",
  "generator": "manual-evidence-normalization-v0.2.3",
  "reviewStatus": "reviewed",
  "publicationStatus": "published",
  "createdAt": "2026-07-27T00:00:00.000Z",
  "updatedAt": "2026-07-27T06:33:22.241Z"
}
