{
  "schemaVersion": "1.0.0",
  "id": "ncom-component-base-model",
  "frameworkId": "ncom",
  "type": "framework_concept",
  "title": "NComponent and defineComponent base model",
  "summary": "Observed base component and registration facts.",
  "scope": {
    "sourceCommit": "a350b576bbeae6c6254273037a17d2a8730fb80f",
    "catalogRootHash": "sha256:0dbfa378eedaaef0b31867b679e7932157eb63bb0cc4e3fa0fb0a0d1869c6518",
    "symbolRootHash": "sha256:52e4461d185ce375263aca5e412b2d93f402d906867bf0940bffc9807eec6297"
  },
  "relatedPackages": [
    "package-ncom-core"
  ],
  "relatedSymbols": [
    "symbol-fca3708ca106bc60",
    "symbol-ce1be56437963bb3"
  ],
  "relatedComponents": [],
  "prerequisites": [],
  "claims": [
    {
      "id": "base-model-observed",
      "text": "The bounded evidence contains the NComponent and defineComponent declarations for this commit.",
      "status": "observed",
      "confidence": "high",
      "evidenceIds": [
        "E1"
      ],
      "appliesTo": [
        "a350b576bbeae6c6254273037a17d2a8730fb80f"
      ],
      "exceptions": [],
      "limitations": [
        "No design intent is inferred."
      ],
      "tags": [
        "component",
        "registration"
      ]
    }
  ],
  "recipes": [],
  "constraints": [],
  "limitations": [
    "Bounded static observation only.",
    "Published after evidence validation and explicit review."
  ],
  "evidence": [
    {
      "id": "E1"
    }
  ],
  "sourceBundleId": "bundle-component-base-model-a350b57-3dfb0583",
  "generator": "manual-evidence-normalization",
  "reviewStatus": "reviewed",
  "publicationStatus": "published",
  "createdAt": "2026-07-23T09:20:00.000Z",
  "updatedAt": "2026-07-23T09:18:18.000Z"
}
