{
  "schemaVersion": "1.0.0",
  "id": "ncom-ncalert-structure",
  "frameworkId": "ncom",
  "type": "component_api",
  "title": "NCAlert public structure",
  "summary": "NCAlert 的公共可达性、close 事件、文档和示例索引。",
  "scope": {
    "sourceCommit": "a350b576bbeae6c6254273037a17d2a8730fb80f",
    "catalogRootHash": "sha256:0dbfa378eedaaef0b31867b679e7932157eb63bb0cc4e3fa0fb0a0d1869c6518",
    "symbolRootHash": "sha256:52e4461d185ce375263aca5e412b2d93f402d906867bf0940bffc9807eec6297"
  },
  "relatedPackages": [
    "package-ncom-components"
  ],
  "relatedSymbols": [
    "symbol-92decd1eba35fe57",
    "symbol-0b38b60be99ffde5"
  ],
  "relatedComponents": [
    "component-078563e274bd74a1"
  ],
  "prerequisites": [],
  "claims": [
    {
      "id": "ncom-ncalert-structure-claim-1",
      "text": "NCAlert 在锁定 Symbol Snapshot 中公共可达，继承 NComponent；登记事件 close，slots 无，文档 1 个，示例文件 7 个。",
      "status": "observed",
      "confidence": "high",
      "evidenceIds": [
        "E1",
        "E2",
        "E3"
      ],
      "appliesTo": [
        "a350b576bbeae6c6254273037a17d2a8730fb80f"
      ],
      "exceptions": [],
      "limitations": [
        "仅适用于锁定 commit 与所列 Evidence；不推断未提供的运行时行为。",
        "结构索引不等同于浏览器行为或视觉回归验证。"
      ],
      "tags": [
        "component",
        "feedback",
        "alert"
      ]
    }
  ],
  "recipes": [],
  "constraints": [],
  "limitations": [
    "仅适用于锁定 commit 与所列 Evidence；不推断未提供的运行时行为。",
    "结构索引不等同于浏览器行为或视觉回归验证。"
  ],
  "evidence": [
    {
      "id": "E1"
    },
    {
      "id": "E2"
    },
    {
      "id": "E3"
    }
  ],
  "sourceBundleId": "bundle-ncalert-api-a350b57-4a873daf",
  "generator": "manual-evidence-normalization-v0.2.3",
  "reviewStatus": "reviewed",
  "publicationStatus": "published",
  "createdAt": "2026-07-27T00:00:00.000Z",
  "updatedAt": "2026-07-27T06:33:52.546Z"
}
