{
  "schemaVersion": "1.0.0",
  "id": "ncom-event-state-update-workflow",
  "frameworkId": "ncom",
  "type": "event_pattern",
  "title": "Event-driven state update workflow",
  "summary": "使用 nc-change 事件 detail 连接组件值变化与调用方状态更新的证据边界。",
  "scope": {
    "sourceCommit": "a350b576bbeae6c6254273037a17d2a8730fb80f",
    "catalogRootHash": "sha256:0dbfa378eedaaef0b31867b679e7932157eb63bb0cc4e3fa0fb0a0d1869c6518",
    "symbolRootHash": "sha256:52e4461d185ce375263aca5e412b2d93f402d906867bf0940bffc9807eec6297"
  },
  "relatedPackages": [
    "package-ncom-components"
  ],
  "relatedSymbols": [],
  "relatedComponents": [],
  "prerequisites": [],
  "claims": [
    {
      "id": "ncom-event-state-update-workflow-claim-1",
      "text": "createChangeEvent 创建名为 nc-change 的 CustomEvent，并把 ChangeEventDetail 放入 detail。",
      "status": "observed",
      "confidence": "high",
      "evidenceIds": [
        "E1",
        "E2",
        "E3",
        "E4",
        "E5",
        "E6"
      ],
      "appliesTo": [
        "a350b576bbeae6c6254273037a17d2a8730fb80f"
      ],
      "exceptions": [],
      "limitations": [
        "仅适用于锁定 commit 与所列 Evidence；不推断未提供的运行时行为。"
      ],
      "tags": [
        "workflow",
        "event",
        "state"
      ]
    }
  ],
  "recipes": [
    {
      "id": "ncom-event-state-update-workflow-recipe-1",
      "steps": [
        "订阅组件的 nc-change 事件。",
        "从事件 detail 读取值并更新调用方状态。"
      ],
      "evidenceIds": [
        "E1",
        "E2",
        "E3",
        "E4",
        "E5",
        "E6"
      ],
      "limitations": [
        "步骤是证据约束的最小流程，不替代目标项目的验收标准。"
      ]
    }
  ],
  "constraints": [],
  "limitations": [
    "仅适用于锁定 commit 与所列 Evidence；不推断未提供的运行时行为。"
  ],
  "evidence": [
    {
      "id": "E1"
    },
    {
      "id": "E2"
    },
    {
      "id": "E3"
    },
    {
      "id": "E4"
    },
    {
      "id": "E5"
    },
    {
      "id": "E6"
    }
  ],
  "sourceBundleId": "bundle-event-state-update-a350b57-284ddc11",
  "generator": "manual-evidence-normalization-v0.2.3",
  "reviewStatus": "reviewed",
  "publicationStatus": "published",
  "createdAt": "2026-07-27T00:00:00.000Z",
  "updatedAt": "2026-07-27T06:33:15.813Z"
}
