{
  "schemaVersion": "1.0.0",
  "id": "ncom-nccard-structure",
  "frameworkId": "ncom",
  "type": "component_api",
  "title": "NCCard public structure",
  "summary": "NCCard 的公共可达性、default/header/footer slots、文档和示例索引。",
  "scope": {
    "sourceCommit": "a350b576bbeae6c6254273037a17d2a8730fb80f",
    "catalogRootHash": "sha256:0dbfa378eedaaef0b31867b679e7932157eb63bb0cc4e3fa0fb0a0d1869c6518",
    "symbolRootHash": "sha256:52e4461d185ce375263aca5e412b2d93f402d906867bf0940bffc9807eec6297"
  },
  "relatedPackages": [
    "package-ncom-components"
  ],
  "relatedSymbols": [
    "symbol-8374259d3ca98a11",
    "symbol-eceed9d0bdf832cd"
  ],
  "relatedComponents": [
    "component-8945793b5db3b667"
  ],
  "prerequisites": [],
  "claims": [
    {
      "id": "ncom-nccard-structure-claim-1",
      "text": "NCCard 在锁定 Symbol Snapshot 中公共可达，继承 NComponent；登记事件 无，slots default, footer, header，文档 1 个，示例文件 5 个。",
      "status": "observed",
      "confidence": "high",
      "evidenceIds": [
        "E1",
        "E2",
        "E3",
        "E4",
        "E5",
        "E6",
        "E7",
        "E8"
      ],
      "appliesTo": [
        "a350b576bbeae6c6254273037a17d2a8730fb80f"
      ],
      "exceptions": [],
      "limitations": [
        "仅适用于锁定 commit 与所列 Evidence；不推断未提供的运行时行为。",
        "结构索引不等同于浏览器行为或视觉回归验证。"
      ],
      "tags": [
        "component",
        "container",
        "card"
      ]
    }
  ],
  "recipes": [],
  "constraints": [],
  "limitations": [
    "仅适用于锁定 commit 与所列 Evidence；不推断未提供的运行时行为。",
    "结构索引不等同于浏览器行为或视觉回归验证。"
  ],
  "evidence": [
    {
      "id": "E1"
    },
    {
      "id": "E2"
    },
    {
      "id": "E3"
    },
    {
      "id": "E4"
    },
    {
      "id": "E5"
    },
    {
      "id": "E6"
    },
    {
      "id": "E7"
    },
    {
      "id": "E8"
    }
  ],
  "sourceBundleId": "bundle-nccard-api-a350b57-0ba57ec2",
  "generator": "manual-evidence-normalization-v0.2.3",
  "reviewStatus": "reviewed",
  "publicationStatus": "published",
  "createdAt": "2026-07-27T00:00:00.000Z",
  "updatedAt": "2026-07-27T06:34:00.929Z"
}
